[
  { "id": "wolf", "name": "늑대", "hp": 12, "defense": 11, "attackBonus": 3, "damage": "1d6", "speed": 4,
    "morale": 0.5, "onDefeat": "deathSave", "tags": ["beast"],
    "loot": [{ "itemId": "wolf_pelt", "qty": 1, "chance": 0.8 }], "food": 1 },
  { "id": "boar", "name": "멧돼지", "hp": 18, "defense": 10, "attackBonus": 3, "damage": "1d6", "speed": 2,
    "morale": 0.3, "onDefeat": "deathSave", "tags": ["beast"], "loot": [{ "itemId": "boar_tusk", "qty": 1, "chance": 0.7 }], "food": 3 },
  { "id": "bandit", "name": "도적", "hp": 18, "defense": 12, "attackBonus": 3, "damage": "1d6", "speed": 2,
    "morale": 0.3, "onDefeat": "robbed", "tags": ["humanoid"],
    "loot": [{ "itemId": "rusty_sword", "qty": 1, "chance": 0.3 }], "silver": 4 },
  { "id": "wild_dog", "name": "들개", "hp": 8, "defense": 10, "attackBonus": 1, "damage": "1d4", "speed": 4,
    "morale": 0.6, "onDefeat": "deathSave", "tags": ["beast"], "loot": [] },
  { "id": "giant_rat", "name": "큰 쥐", "hp": 6, "defense": 9, "attackBonus": 1, "damage": "1d3", "speed": 3,
    "morale": 0.5, "onDefeat": "deathSave", "tags": ["beast"], "loot": [] },
  { "id": "poacher", "name": "밀렵꾼", "hp": 12, "defense": 10, "attackBonus": 1, "damage": "1d4", "speed": 3,
    "morale": 0.6, "onDefeat": "robbed", "tags": ["humanoid"],
    "loot": [], "silver": 3 },
  { "id": "goblin_scout", "name": "고블린 정찰병", "hp": 12, "defense": 12, "attackBonus": 2, "damage": "1d4+1", "speed": 3,
    "morale": 0.5, "onRoutFlag": "goblin_alerted", "onDefeat": "deathSave", "tags": ["goblin"],
    "loot": [{ "itemId": "goblin_token", "qty": 1, "chance": 1 }] },
  { "id": "goblin_warrior", "name": "고블린 전사", "hp": 24, "defense": 14, "attackBonus": 4, "damage": "1d8", "speed": 2,
    "onDefeat": "deathSave", "tags": ["goblin"], "loot": [{ "itemId": "goblin_axe", "qty": 1, "chance": 0.5 }] },
  { "id": "raid_leader", "name": "약탈단 두목", "hp": 36, "defense": 13, "attackBonus": 4, "damage": "1d8+1", "speed": 2,
    "onDefeat": "scripted", "tags": ["goblin", "boss"], "loot": [] },
  { "id": "arena_brawler", "name": "마을 장정", "hp": 12, "defense": 10, "attackBonus": 2, "damage": "1d4", "speed": 2,
    "morale": 0.3, "onDefeat": "deathSave", "tags": ["humanoid"], "loot": [] },
  { "id": "arena_mercenary", "name": "떠돌이 용병", "hp": 18, "defense": 12, "attackBonus": 3, "damage": "1d6", "speed": 3,
    "onDefeat": "deathSave", "tags": ["humanoid"], "loot": [] },
  { "id": "arena_champion", "name": "결투장 우승자 가렛", "hp": 24, "defense": 13, "attackBonus": 4, "damage": "1d6+1", "speed": 3,
    "onDefeat": "deathSave", "tags": ["humanoid"], "loot": [] },
  { "id": "hero_adel", "name": "용사 아델", "hp": 32, "defense": 14, "attackBonus": 5, "damage": "1d8", "speed": 4,
    "onDefeat": "deathSave", "tags": ["humanoid"], "loot": [] }
]
